{
  "$schema": "../../../schemas/marketplace.schema.json",
  "name": "skillsplace",
  "displayName": "Skillsplace Marketplace",
  "version": "0.1.0",
  "description": "Fixture marketplace.",
  "packages": [
    {
      "name": "Qiongli Next",
      "slug": "qiongli-next",
      "version": "1.4.0-beta.1",
      "description": "Pre-release Qiongli channel.",
      "manifest": "https://github.com/jxpeng98/qiongli/releases/download/v1.4.0-beta.1/qiongli-next-codex-plugin-v1.4.0-beta.1.tar.gz",
      "platforms": {
        "codex": {
          "type": "plugin",
          "path": "https://github.com/jxpeng98/qiongli/releases/download/v1.4.0-beta.1/qiongli-next-codex-plugin-v1.4.0-beta.1.tar.gz",
          "marketplace": "https://github.com/jxpeng98/skillsplace/blob/main/.agents/plugins/marketplace.json"
        },
        "claude": {
          "type": "plugin",
          "path": "https://github.com/jxpeng98/qiongli/releases/download/v1.4.0-beta.1/qiongli-next-claude-plugin-v1.4.0-beta.1.tar.gz",
          "marketplace": "https://github.com/jxpeng98/skillsplace/blob/main/.claude-plugin/marketplace.json"
        }
      }
    }
  ]
}
